Headline,Date
"Sturgeon remain rare in Great Lakes, but Detroit River's population thrives",2024-05-27 16:44:06+00:00
China Slams G-7 for ‘Hyping’ Overcapacity as Trade Tensions Soar,2024-05-27 16:42:12+00:00
ET Market Watch: Sensex & Nifty Flat After Record Highs; Auto & Energy Stocks Fall,2024-05-27 16:42:10+00:00
Chainlink and SWIFT Set to Unveil Major Partnership,2024-05-27 16:34:06+00:00
China book corner set up at Kenya workers training institution,2024-05-27 16:31:28+00:00
CAE reports fourth quarter and full fiscal year 2024 results,2024-05-27 16:30:00+00:00
Hedge Fund Bailouts Could Bankrupt the Nation,2024-05-27 16:28:11+00:00
"Bitcoin Halving Not Priced In Despite Hitting New Lifetime Highs, Top Analyst Asserts — BTC To $100,000?",2024-05-27 16:21:08+00:00
[Removed],1970-01-01 00:00:00+00:00
Closing arguments set for Tuesday in Donald Trump’s hush money trial,2024-05-27 16:18:48+00:00
"This Young Professional Left Her Job in Finance After Her Remote Side Hustle Took Off and Made $65,000: 'My Idea Solves a Universal Problem'",2024-05-27 16:16:09+00:00
Turkcell Iletisim Hizmetleri: First Quarter 2024 Results,2024-05-27 16:16:04+00:00
Insurance Provider Apollo Forms Subsidiary to Offer BNPL in Canada,2024-05-27 16:12:52+00:00
Horn of Africa droughts: Research shows how a network of groundwater bores could help,2024-05-27 16:11:04+00:00
Turkcell Iletisim Hizmetleri: First Quarter 2024 Results,2024-05-27 16:06:05+00:00
"Freenet AG: Release according to Article 40, Section 1 of the WpHG [the German Securities Trading Act] with the objective of Europe-wide distribution",2024-05-27 16:06:05+00:00
UK should support Moroccan sovereignty over Western Sahara – British MPs,2024-05-27 16:03:18+00:00
"Freenet AG: Release according to Article 40, Section 1 of the WpHG [the German Securities Trading Act] with the objective of Europe-wide distribution",2024-05-27 16:01:05+00:00
Letitia James warns crypto firms: ‘Play by same rules’ or…,2024-05-27 16:00:43+00:00
Mib rises and ECB cuts in sight; boost on Zignago,2024-05-27 16:00:27+00:00
Sceptre & Ledger Works partner to re-invent risk management for liquid staking,2024-05-27 16:00:00+00:00
"Best Buy is the most impersonated company by scammers, FTC says",2024-05-27 15:57:00+00:00
Dollar firm ahead of global inflation data,2024-05-27 15:53:51+00:00
KLÉPIERRE: S&P INCREASES KLÉPIERRE'S OUTLOOK TO POSITIVE AFTER THE ROMAEST ACQUISITION,2024-05-27 15:45:14+00:00
Virtus Investment Partners (VRTS) Could Be a Great Choice,2024-05-27 15:45:08+00:00
The Significance Of The US-Kenya Climate & Clean Energy Industrial Partnership,2024-05-27 15:41:57+00:00
‘I’m looking for a man in finance’: The song of the summer’s here—and it’s not close,2024-05-27 15:39:02+00:00
10-year bond yield falls to near-one-year low on RBI’s record surplus dividend transfer to govt,2024-05-27 15:37:29+00:00
Fintech’s Blue-Chip Vanguard: 3 Stocks Shaping the Future of Finance,2024-05-27 15:34:14+00:00
Directors of rugby agree on overseas player rule,2024-05-27 15:33:57+00:00
National Grid plc : High voltage,2024-05-27 15:33:31+00:00
Want to work from home? A hefty paycheck may be out of reach as high-wage remote jobs fade,2024-05-27 15:32:47+00:00
"Diesel subsidy: Agriculture sector operators must be registered with GeoAgro, says ministry",2024-05-27 15:31:00+00:00
Director-General’s Award for Global Health go to Prime Minister of Barbados and developers of mRNA vaccines for COVID-19,2024-05-27 15:26:58+00:00
"25,190 Shares in Blackstone Mortgage Trust, Inc. (NYSE:BXMT) Acquired by Chesapeake Capital Corp IL",2024-05-27 15:24:46+00:00
"Samsung Galaxy F55 5G with AI features launched at Rs 24,999",2024-05-27 15:22:51+00:00
Government should incentivise staff accommodation development – KPMG,2024-05-27 15:22:34+00:00
The Great Reflation: Why the silver and gold trade has further upside,2024-05-27 15:20:10+00:00
Pinstripes (NYSE:PNST) versus Cannae (NYSE:CNNE) Head-To-Head Comparison,2024-05-27 15:18:43+00:00
Atlantis Technology Group (OTCMKTS:ATNP) versus Palmer Square Capital BDC (NYSE:PSBD) Head-To-Head Survey,2024-05-27 15:18:42+00:00
Head to Head Survey: Amerant Bancorp (NASDAQ:AMTB) & Akbank T.A.S. (OTCMKTS:AKBTY),2024-05-27 15:18:41+00:00
Simsek Says Record Inflows Will Target Long-Term Turkish Debt,2024-05-27 15:16:40+00:00
Billionaire 'Bond King' Bill Gross says a Trump win would be 'disruptive' for markets - Yahoo Finance,2024-05-27 15:13:06+00:00
Finance minister Michael McGrath speaks to the media about cost-of-living and tax measures in the next budget,2024-05-27 15:12:40+00:00
"Azerbaijan may borrow $5 billion for major infrastructure projects, finance minister says",2024-05-27 15:12:00+00:00
News24 | Development Bank to set up its first biodiversity fund,2024-05-27 15:08:03+00:00
"Azerbaijan may borrow $5 bln for major infrastructure projects, finance minister says",2024-05-27 15:01:47+00:00
Analysis-Israeli-Turkish trade on life support as relations hit bottom,2024-05-27 15:01:41+00:00
GCCs: Unlocking the potential of Tier-2 cities,2024-05-27 15:00:52+00:00
"BioSenic S.A. : Positive vote of the majority of creditors in favor of the global restructuring plan of BioSenic covering the years 2024-2032, at the Enterprise Court of Nivelles",2024-05-27 15:00:06+00:00
"BioSenic S.A. : Positive vote of the majority of creditors in favor of the global restructuring plan of BioSenic covering the years 2024-2032, at the Enterprise Court of Nivelles",2024-05-27 15:00:00+00:00
"Shark Tank India's Radhika Gupta shares her tip on parenthood, beyond finance",2024-05-27 14:58:33+00:00
Ticker: ‘Firm’ helps those cut off from China trade; G7 look to grab frozen funds from Russia,2024-05-27 14:58:09+00:00
Should Elon Musk be paid $56 billion? Tesla shareholders get to vote,2024-05-27 14:58:00+00:00
"Hsbc Holdings PLC Purchases 252,151 Shares of State Street Co. (NYSE:STT)",2024-05-27 14:56:42+00:00
Ticker: ‘Firm’ helps those cut off from China trade; G7 look to grab frozen funds from Russia,2024-05-27 14:56:29+00:00
"Disclosure of total number of voting rights and number of shares in the capital at April 30, 2024",2024-05-27 14:53:00+00:00
Ethereum ETF Approval Triggers Massive User Growth at StakingFarm,2024-05-27 14:52:00+00:00
Israeli-Turkish trade on life support as relations hit bottom,2024-05-27 14:51:19+00:00
Data reveals rising economic 'distress' across America despite post-pandemic growth,2024-05-27 14:50:14+00:00
China launches $47bn super-chip fund,2024-05-27 14:49:27+00:00
"Cape Investment Advisory Inc. Makes New $134,000 Investment in Bain Capital Specialty Finance, Inc. (NYSE:BCSF)",2024-05-27 14:44:49+00:00
"LOOK: Queen Máxima of the Netherlands visits Maya office, discusses women's financial health efforts",2024-05-27 14:44:17+00:00
"Thailand plans stimulus as 2024 growth seen low at 2.5%, Finance Minister says",2024-05-27 14:40:13+00:00
"New ""Barbora"" CEO - Povilas Šulys",2024-05-27 14:35:00+00:00
Ghana central bank holds rate as currency slide slows disinflation,2024-05-27 14:33:18+00:00
OKOMU OIL PALM : RESOLUTIONS PASSED AT THE 44TH AGM OF THE OKOMU OIL PALM COMPANY PLC,2024-05-27 14:31:47+00:00
EthosX Launches New Perpetual Options Product,2024-05-27 14:30:41+00:00
Coco Pool Corp. Announces Proposed Qualifying Transaction With Viridian Metals Corp.,2024-05-27 14:27:02+00:00
Coco Pool Corp. Announces Proposed Qualifying Transaction With Viridian Metals Corp.,2024-05-27 14:25:06+00:00
Indian government fixes record 447 lakh tonnes target for oilseeds production in 2024-25,2024-05-27 14:24:53+00:00
"Intech Investment Management LLC Reduces Stock Position in Workday, Inc. (NASDAQ:WDAY)",2024-05-27 14:24:49+00:00
"Intech Investment Management LLC Acquires 6,816 Shares of CarMax, Inc. (NYSE:KMX)",2024-05-27 14:24:48+00:00
What Prof. Turley shows us in the Trump case calls for jury nullification (a deep dive),2024-05-27 14:24:35+00:00
Coco Pool Corp. Announces Proposed Qualifying Transaction With Viridian Metals Corp.,2024-05-27 14:24:00+00:00
90%–95% Welfare Loot to Foreign Invaders,2024-05-27 14:13:58+00:00
"Jio bypasses telco role, as Radisys, NGIC team up to boost Africa's 5G infra",2024-05-27 14:09:25+00:00
Samsung launches made-in-India Galaxy F55 5G smartphone,2024-05-27 14:06:54+00:00
China Pumps Tens Of Billions Into Key Industry Amid Tech War With US,2024-05-27 14:04:06+00:00
"MorphoSys AG: Release according to Article 40, Section 1 of the WpHG [the German Securities Trading Act] with the objective of Europe-wide distribution",2024-05-27 14:04:06+00:00
Privacy-preserving artificial intelligence: training on encrypted data,2024-05-27 14:03:57+00:00
The 57+ best Amazon Memorial Day 2024 sales,2024-05-27 14:03:54+00:00
"MorphoSys AG: Release according to Article 40, Section 1 of the WpHG [the German Securities Trading Act] with the objective of Europe-wide distribution",2024-05-27 14:02:06+00:00
"Microstrategy’s Michael Saylor Says Spot Ethereum ETFs Approvals Is Good For Bitcoin, Here’s Why",2024-05-27 14:00:58+00:00
Ambition and Plowing in Hope,2024-05-27 14:00:00+00:00
BitStore.com Announces Integration of USDD Stablecoin for Global Transactions,2024-05-27 14:00:00+00:00
"HelloFresh SE: Release according to Article 40, Section 1 of the WpHG [the German Securities Trading Act] with the objective of Europe-wide distribution",2024-05-27 13:57:06+00:00
"Economic chiefs weigh steps to lift growth, credit access",2024-05-27 13:56:00+00:00
"Johnson Financial Group Inc. Invests $126,000 in SAP SE (NYSE:SAP)",2024-05-27 13:54:45+00:00
Cardinal Energy : Announces Extension of Dividend,2024-05-27 13:53:11+00:00
Brazil's Gol says bankruptcy exit to involve $1.5 billion capital injection,2024-05-27 13:50:54+00:00
"New accounting methods helped Centre to save over ₹25,000 cr, says FM Sitharaman",2024-05-27 13:49:36+00:00
Sirma : Money20/20 Europe 2024 - Unveiling the Future of Financial Technology,2024-05-27 13:43:30+00:00
"Johnson Financial Group Inc. Buys 9,850 Shares of Associated Banc-Corp (NYSE:ASB)",2024-05-27 13:42:49+00:00
A Step-by-Step Guide on How to Purchase Solana,2024-05-27 13:42:27+00:00
Micron gets hit with a whopping $445 million damages bill after it was found liable for patent infringements,2024-05-27 13:40:09+00:00
Financial Advisory Global Market Report 2024: A $261.95 Billion Market by 2028 at a CAGR of 5%,2024-05-27 13:40:00+00:00
HOGE is Officially BASE(D),2024-05-27 13:30:40+00:00
HOGE is Officially BASE(D),2024-05-27 13:28:10+00:00
Data reveals rising economic 'distress' across America despite post-pandemic growth,2024-05-27 13:26:10+00:00
